id_ticket,id_usuario,titulo,prioridad,problema,estado,tecnico_id,respuesta
1,101,Alta,Error en la aplicaci贸n,La aplicaci贸n se cierra inesperadamente,Abierto,3000,SIN RESPUESTA
2,102,Media,Problema de red,No se puede conectar a Internet,Abierto,3000,SIN RESPUESTA
3,103,Baja,Solicitud de informaci贸n,Necesito informaci贸n sobre el producto,Cerrado,3000,SIN RESPUESTA
4,101,Error 404,Alta,Me figura un error 404 cuando ingreso a la pagina,Abierto,3000,SIN RESPUESTA
5,101,Base de datos caida,Alta,La base de datos no funciona,Abierto,
